<!--

    Licensed to Jasig under one or more contributor license
    agreements. See the NOTICE file distributed with this work
    for additional information regarding copyright ownership.
    Jasig licenses this file to you under the Apache License,
    Version 2.0 (the "License"); you may not use this file
    except in compliance with the License. You may obtain a
    copy of the License at:

    http://www.apache.org/licenses/LICENSE-2.0

    Unless required by applicable law or agreed to in writing,
    software distributed under the License is distributed on
    an "AS IS" BASIS, WITHOUT WARRANTIES OR CONDITIONS OF ANY
    KIND, either express or implied. See the License for the
    specific language governing permissions and limitations
    under the License.

-->

<xs:schema xmlns="https://source.jasig.org/schemas/portlet/athletics/athletics-feed"
    targetNamespace="https://source.jasig.org/schemas/portlet/athletics/athletics-feed"
    xmlns:xs="http://www.w3.org/2001/XMLSchema" xmlns:xsi="http://www.w3.org/2001/XMLSchema-instance"
    elementFormDefault="qualified" attributeFormDefault="unqualified" version="1.0">

    <xs:element name="athletics-feed">
        <xs:complexType>
            <xs:sequence>
                <xs:element ref="sport" maxOccurs="unbounded"/>
            </xs:sequence>
        </xs:complexType>
    </xs:element>

    <xs:element name="sport">
        <xs:complexType>
            <xs:sequence>
                <xs:element ref="news-item" minOccurs="0" maxOccurs="unbounded"/>
                <xs:element ref="competition" minOccurs="0" maxOccurs="unbounded"/>
            </xs:sequence>
        <xs:attribute name="name"/>
        </xs:complexType>
    </xs:element>
    
    <xs:element name="news-item">
        <xs:complexType>
            <xs:sequence>
                <xs:element name="title" type="xs:string"/>
                <xs:element name="date" type="xs:string"/>
                <xs:element name="summary" type="xs:string" minOccurs="0"/>
                <xs:element name="image-url" type="xs:string" minOccurs="0"/>
                <xs:element name="story-url" type="xs:string" minOccurs="0"/>
            </xs:sequence>
        </xs:complexType>
    </xs:element>
    
    <xs:element name="competition">
        <xs:complexType>
            <xs:attribute name="date" type="xs:string"/>
            <xs:attribute name="time" type="xs:string"/>
            <xs:attribute name="name" type="xs:string"/>
            <xs:attribute name="location" type="xs:string"/>
            <xs:attribute name="result" type="xs:string"/>
            <xs:attribute name="url" type="xs:string"/>
        </xs:complexType>
    </xs:element>

</xs:schema>